{
  "schemaVersion": 1,
  "generatedAtUtc": "2026-10-17T15:37:54+00:00",
  "sourceMode": "official-publication-watch",
  "collection": {
    "status": "partial",
    "sourceCount": 3,
    "failureCount": 1,
    "retainedItemCount": 5,
    "sourceStatus": [
      {
        "id": "un-middle-east",
        "name": "United Nations News — Middle East",
        "status": "stale-retained",
        "itemCount": 5,
        "url": "https://news.un.org/en/news/region/middle-east",
        "detail": "Refresh failed: not well-formed (invalid token): line 1, column 0"
      },
      {
        "id": "us-war-news",
        "name": "U.S. Department of War — News",
        "status": "current",
        "itemCount": 1,
        "url": "https://www.war.gov/News/",
        "detail": "Official RSS feed checked successfully."
      },
      {
        "id": "us-war-releases",
        "name": "U.S. Department of War — Releases",
        "status": "current",
        "itemCount": 1,
        "url": "https://www.war.gov/News/Releases/",
        "detail": "Official RSS feed checked successfully."
      }
    ]
  },
  "items": [
    {
      "id": "30a3e11da6b05778",
      "title": "Security Council LIVE: Deaths, demolitions spike in Gaza, West Bank",
      "summary": "Amid a rise in lethal Israeli strikes, demolitions and violence in Gaza and the West Bank, the Security Council held an open debate on Thursday focusing on the current situation in the Occupied Palestinian Territory.",
      "publishedAt": "2026-10-15T12:00:00+00:00",
      "url": "https://news.un.org/feed/view/en/story/2026/10/1168599",
      "source": {
        "id": "un-middle-east",
        "name": "United Nations News — Middle East",
        "pageUrl": "https://news.un.org/en/news/region/middle-east"
      },
      "tags": [
        "Israel / Gaza"
      ],
      "dataState": "stale-retained"
    },
    {
      "id": "b572cf8a23276474",
      "title": "Centcom Forces Disable Cargo Vessel Attempting to Violate Blockade",
      "summary": "Service members operating in the U.S. Central Command area of responsibility recently disabled a commercial cargo vessel in the Gulf of Oman, after the ship's crew ignored repeated warnings and attempted to run the ongoing naval blockade against Iran.",
      "publishedAt": "2026-10-13T16:14:00+00:00",
      "url": "https://www.war.gov/News/News-Stories/Article/Article/4624371/centcom-forces-disable-cargo-vessel-attempting-to-violate-blockade/",
      "source": {
        "id": "us-war-news",
        "name": "U.S. Department of War — News",
        "pageUrl": "https://www.war.gov/News/"
      },
      "tags": [
        "Shipping"
      ],
      "dataState": "current"
    },
    {
      "id": "b7600be984a428bc",
      "title": "Security Council LIVE: Syria’s fragile transition – economic strain, Israeli incursions and progress towards elections",
      "summary": "The Security Council met to debate Syria's thorny transition Monday as it faces pressure on several fronts. Economic hardship is fuelling unrest, Israeli incursions continue in the south and sectarian tensions persist in Sweida, even as Damascus reports progress on its chemical weapons programme and talks about future elections. Millions, meanwhile, remain displaced. Follow live below and go here for full meetings…",
      "publishedAt": "2026-10-12T12:00:00+00:00",
      "url": "https://news.un.org/feed/view/en/story/2026/10/1168578",
      "source": {
        "id": "un-middle-east",
        "name": "United Nations News — Middle East",
        "pageUrl": "https://news.un.org/en/news/region/middle-east"
      },
      "tags": [
        "Israel / Gaza"
      ],
      "dataState": "stale-retained"
    },
    {
      "id": "46ee2fe0635c6d70",
      "title": "Sustaining livelihoods amid crisis in Gaza",
      "summary": "Nidaa, Hanaa and Hanin have different stories, but share a common thread: the determination to build something of their own and keep it going despite extraordinary challenges facing them in war-ravaged Gaza.",
      "publishedAt": "2026-10-11T12:00:00+00:00",
      "url": "https://news.un.org/feed/view/en/story/2026/10/1168569",
      "source": {
        "id": "un-middle-east",
        "name": "United Nations News — Middle East",
        "pageUrl": "https://news.un.org/en/news/region/middle-east"
      },
      "tags": [
        "Israel / Gaza"
      ],
      "dataState": "stale-retained"
    },
    {
      "id": "e6f4361c726f2b6e",
      "title": "Security Council LIVE: Yemen has fallen back into full-scale war, warns UN envoy",
      "summary": "The Security Council met to discuss the crisis in Yemen Friday, where a Houthi offensive launched in September has sharply escalated the 12-year-long war for control of the country and spillover from the US-Iran war has provoked a new displacement crisis. Live coverage below and for full meetings updates, go here.",
      "publishedAt": "2026-10-09T12:00:00+00:00",
      "url": "https://news.un.org/feed/view/en/story/2026/10/1168559",
      "source": {
        "id": "un-middle-east",
        "name": "United Nations News — Middle East",
        "pageUrl": "https://news.un.org/en/news/region/middle-east"
      },
      "tags": [
        "Conflict"
      ],
      "dataState": "stale-retained"
    },
    {
      "id": "800aaa87e960c02e",
      "title": "Systems Selected for JIATF 401 Directed-Energy Counter-Drone Pilot Program",
      "summary": "The War Department announced the directed-energy systems selected following the Joint Interagency Task Force 401's counter-unmanned aircraft systems-directed energy pilot program, marking the next phase of efforts to expand the operational use of high-energy laser and high-powered microwave capabilities.",
      "publishedAt": "2026-10-05T19:55:07+00:00",
      "url": "https://www.war.gov/News/Releases/Release/Article/4619430/systems-selected-for-jiatf-401-directed-energy-counter-drone-pilot-program/",
      "source": {
        "id": "us-war-releases",
        "name": "U.S. Department of War — Releases",
        "pageUrl": "https://www.war.gov/News/Releases/"
      },
      "tags": [
        "Energy"
      ],
      "dataState": "current"
    },
    {
      "id": "220ed128ca56a9fc",
      "title": "Escalating fighting in Yemen deepens food security crisis",
      "summary": "Renewed conflict in Yemen has triggered a surge in hunger that could have consequences in the wider region and beyond, the World Food Programme (WFP) warned on Friday.",
      "publishedAt": "2026-10-02T12:00:00+00:00",
      "url": "https://news.un.org/feed/view/en/story/2026/10/1168509",
      "source": {
        "id": "un-middle-east",
        "name": "United Nations News — Middle East",
        "pageUrl": "https://news.un.org/en/news/region/middle-east"
      },
      "tags": [
        "Conflict"
      ],
      "dataState": "stale-retained"
    }
  ],
  "methodology": "Official-source publication monitor filtered for market-relevant conflict terms. Headlines report what the named source published; they are not independent verification. Market transmission shown in Command Centre is conditional research analysis."
}
